FrontText,BackText,Comment,FrontTextLanguage,BackTextLanguage
Plan,"構図, 計画, 法返(し), 図, 計略, 線図, 工作, 積(も)り, 絵図, 機軸, あらまし, あらまし, 目ろみ, ちゅう略, あらまし事, 謀(り), 企て, 意, スケジュール, 心掛(け), 手順, 目算, 手はず, 絵図面, たくらみ, 一案, 工匠, 発案, あや, 図面, 計画案, 手の内, 才覚, 結構, 結構, 腹積(も)り, 意図, 考案, 企図, 計, 策, 設計, 寸法, 方策, ディザイン, 筋書(き), 工夫, 趣向, 意匠, 方針, 仕組(み), プラン, プラン, 思い付(き), 抱負, はかりごと, 腹案, 方略, 心算, 構想, 具案, 設計図, 企画, 案, 案, 地図, 心匠, 調略, スキーム, 方案, 事, 段取(り), デザイン, めど, 略, 順序書き, ちゅう画, 予定, 画策, 策戦, 伏(せ)図, 計策",,de-DE,ja-JP
Bücher,"書籍, 帳簿, 書冊, 図書, 書物, 会計簿, 編章, 典籍, 書籍, 典じゃく",,de-DE,ja-JP
Netzwerk,"網状組織, ネット･ワーク, 組織網, ネット, 網目細工, 細網",,de-DE,ja-JP
betont,"アクセントのある, 上げる, 上げる, マルカートの",,de-DE,ja-JP
Rückkehr,"帰還, 再帰, 還, 来復, げん来, 復帰, 帰着, リターン, 逆戻(り), 戻(り), 帰り, カム･バック, 来, 来い",,de-DE,ja-JP
wenden,"裏返しにする, 転じる, 反覆する, 裏返す, 整流する, 旋回する, 折(り)返す, 折(り)返す, Uターンする",,de-DE,ja-JP
geeignet,"しかるべく, 適宜, 適した, 好都合の, よろしく, 適宜の, しかるべき, 妥当な, よろしい, よろしい, 好都合な, 〈相応〉しい, 適任の, 相応な, 適用し得る, 好都合に, 良しなに, 打って付けの, 穏当な, あつらえ向きの, 相当な, 適切な, 頃合いの, 適当な, よろぴく, スータブル",,de-DE,ja-JP
Drittel,三分,,de-DE,ja-JP
beziehungsweise,"若(し)くは, 若(し)くは",,de-DE,ja-JP
Veröffentlichung,"発だ, せん修, 刊行, 版行, ディスクロージャ, ソフト化, 開示, ディスクローシャー, 登場, 出版物, 宣布, 刊行物, 公刊, 布達, ディスクロージャー, 告示, 発表, リリース, 編章, 掲載, レリーズ, 発行, 登載, 出版",,de-DE,ja-JP
Arzt,"しゃじ, ドクトル, 刀けい家, 医者, 医家, 医師, さじ, 医道者, 医学者, 医, ドクター, くす師, 医伯",,de-DE,ja-JP
nahezu,"近く, 近く, やがて",,de-DE,ja-JP
daraus,この中,,de-DE,ja-JP
Fähigkeiten,"たしなみ, 実力",,de-DE,ja-JP
Antwort,"応酬, 挨拶, 諾唯, いらえ, 返(し), リスポンス, 答案, 返答, 受(け)答(え), 返事, 音, レスポンス, 応答, 解答, 回報, 対応, レス, 解, 返(り)言, 回答, 報答, 答(え), 答弁, A, 心, 返す言葉, 受(け)答(え), アンサー, リプライ, リプ, 返詞",,de-DE,ja-JP
Vermieter,"賃貸人, 貸(し)手, 家主, 家主, 貸(し)主, 宿屋の主人, 大家, たな主, ランドロード",,de-DE,ja-JP
Wechsel,"切(り)替(え), 更迭, 変(わ)り目, 異動, 入(れ)代(わ)り, 転変, 入(れ)替(え), 曲折, トランスファー, 変遷, 移り変(わ)り, 変動, {為替}, 番代(わ)り, ビル, 差(し)替え, 推移, 交番, 変化, 取(り)替え, 乗(り)換(え), 手形, 交替, 動き, 変(わ)り, 移行, トランスファ, 代わりごっこ, 迭",,de-DE,ja-JP
Nachrichten,ニュース,,de-DE,ja-JP
Rede,"挨拶, 舌せん, 演説, 話, 弁論, 物, 話法, 談話, 言辞, 口上, 言(い)分, がいだ, スピーチ, 辞, 〈台詞〉, 講演, お話し, デクラメーション",,de-DE,ja-JP
Brand,"腐肉, かい禄, 焼成, 脱そ, 火, 祝融, うどんこ病, 焼け, 出火, えそ, 火事, 火災, 火難, 赤猫",,de-DE,ja-JP
Polen,"ポーランド, ポルスカ",,de-DE,ja-JP
starten,"雄飛する, 立(ち)上がる, 離陸する, 出場する, 駆(け)出す, 興す, スタートを切る, 立(ち)上げる, 始動する, 出走する, スタートする, 起動する, 幕が開く, 入れる, 掛(か)る, 出発する, 乗(り)掛ける, 発走する, 作動させる, 出立する, 口火を切る, キック・オフする",,de-DE,ja-JP
Aufnahme,"待遇, 撮影, 編入, トランスクリプション, ショット, 吹(き)込み, レコーディング, 客扱(い), テイク, 受(け)入れ, 加入, 取(り)扱(い), 持(て)成し, あしらい, 写真, アドミッション, 採用, 採択, テーク, 収容, 収録, 付(き), 遇, 摂取量, 接待, お持て成し, 摂取, 録音, 客あしらい, 開始, インテーク",,de-DE,ja-JP
Hans,ハンス,,de-DE,ja-JP
unmittelbar,"直(ち)に, 瞬く間, 直接に, 実感的, 直接的, 真(っ)向から, 無造作に, すぐ, すぐさま, 目の当(た)り, 相対で, てき面の, 真っ向に, 直様, 直接の, 直接的な, 瞬く間, 間もない, 直接的に, 瞬く内, 無媒介的, 直観の",,de-DE,ja-JP
Sprecher,"スポークスマン, 議長, 代弁業, アナウンサー, 話(し)手, 表現主体, 代弁者, スピーカー, 弁士, 発言者, 名代, MC, 語(り)手, 語(り)手, 語(り)手, ナレーター, アナ, 話者, スポークス･パーソン, 発話者",,de-DE,ja-JP
Gegner,"あだ, 対抗者, 讐敵, 反対者, 対敵, 敵, あだかたき, 対者, 敵手, 敵, 相手, 対手, お相手, 相手方, 対戦相手, 抵抗者, 相手方, きゅうえん, 敵キャラクター, 敵キャラ",,de-DE,ja-JP
Mittelpunkt,"中点, 根幹, 仲間, 骨, 骨, 中心, 枢軸, 中心地, センター・スポット",,de-DE,ja-JP
1. Januar,"{一日}, さく旦",,de-DE,ja-JP
geöffnet,開けたまま,,de-DE,ja-JP
Freund,"メート, 寄(る)辺, ボーイ･フレンド, 党与, 彼氏, フレンド, 友, 友人, メイト, 仲間, {友達}, 知人, 愛人, アミー, 交友, ほう友, L, アミーゴ, ともがら, 味方, リーベ, 相手, 愛好家, 党輩, お相手, よい友だち, 友垣, 恋人, アミ, 知(る)辺, フレ, 交際相手, だち, だち公, 同ほう, BF",,de-DE,ja-JP
Spitze,"尾のえ, 端部, チップ, 首脳, 端, 天井, 超まい, 機ほう, てっ辺, 首位, 突端, 頭, 端, 末端, 上端, うら, 剣先, ピーク, 首班, 頂上, 先端, 頂点, 頂点, 上, 頂, レース, 先ぽう, せん頭, ビット, とっぱな, 先兵, 先頭, 端, 空, 首席, 先点, 先, 鼻先, 首部, 主位, 心, トップ, せん頭器, 先っぽ, 端っこ, 端っこ, 先っちょ, とがり, とんがり, 棒鼻, ティップ, せん点, 端っぽ, リーディング･エッジ, 極盛",,de-DE,ja-JP
1996,千九百九十六,,de-DE,ja-JP
Anmeldung,"取(り)次(ぎ), 予約, 御案内, 届(け)出, 申告, 案内, 出願, 申(し)込み, 届け出で, チェック･イン, 申し込み所, 届(け), エントリー, 応募",,de-DE,ja-JP
Münster,"ミュンスター, 大聖堂, ムンスター, マンステール",,de-DE,ja-JP
1995,千九百九十五,,de-DE,ja-JP
Rat,"参事官, 異見, 勧(め), 献策, 相談, 忠告, 心添え, 顧問官, 進言, 諭し, 意見, 参与, 口添(え), しょうよう, 助言, アドバイス, 勧告, 訓辞, 忠言, ヒント, 審議会, 評議員, 議定官, 参事, 助言, 理事会, 協議会, 建策, 参議会",,de-DE,ja-JP
Kurs,"航路, 船路, 講座, レート, 水路, 講習, 方向, 学科, 走路, 路線, 進路, ワークショップ, 経路, 道, 方針, 機首方位, 相場, プライス, 流通, コース, コース, ベクトル, 講習会, 教室, 競走路, 換算レート, 船路",,de-DE,ja-JP
meinen,"言う, 考える, 愚考する, 取る, 思う, 思し召す, 言う, 申(し)上げる",,de-DE,ja-JP
unbedingt,"どうにもこうにも, 必ずや, 構えて, 急度, たまらなく, 絶対, 絶対, 外れのない, 至って, どうでも, 〈如何〉しても, 断固, 断固として, 断じて, たって, 断然, 絶対に, 必(ず), 絶対的な, 是非, 是非, 断々固, 万, 仕方無い, 断々固たる, 断固たる, 〈如何〉にも, 〈如何〉にも, 是非に",,de-DE,ja-JP
Alexander,アレクサンダー,,de-DE,ja-JP
eigenes,自分の,,de-DE,ja-JP
Vorsitzender,"議長, 会頭, チェア･パーソン, ボス, 司会者, 主宰者, 座長, 取締役, 主審, チェア･マン",,de-DE,ja-JP
Dauer,"持続期間, 悠久, 継続, 持続時間, 入院日数",,de-DE,ja-JP
Absatz,"条, 段落, 間欠, はけ, 販売, ディストリビューション, 足, 売(れ), さばき, 売(れ)足, 段, 段, パラグラフ, 節, ヒール, 踊(り)場, 文段, 前楽節, 項目, 売却, 売(れ)行(き), 売りさばき",,de-DE,ja-JP
Umfang,"範囲, らち, ボリュウム, ボリューム, レインジ, 外回り, 結構, 結構, 裾野, 高, 一回(り), ヴォリューム, 規模, 広狭, 周(り), かさ, 回り, 巡(り), 程度, 程度, 音域, 周回, 外囲, 周囲, 大きさ, ボリウム, エクステント, 周長",,de-DE,ja-JP
warten,"待つ, 手掛ける, 控える, 控える, 看",,de-DE,ja-JP
I,"I, I, I",,de-DE,ja-JP
Motto,"モットー, 標語, 合(い)言葉, 題詞, 座右の銘, 題字, 歌い文句, 銘, 題言, 題辞, 座右銘, 信条, 銘文, スローガン, タグライン",,de-DE,ja-JP
1991,千九百九十一,,de-DE,ja-JP
Vorteil,"アドバンテージ, メリット, 余沢, プラス, 特典, 長所, 利得, 好都合, 便宜, バンテージ, 実益, 利点, 所長, 便益, 取(り)柄, 強み, 良さ, 利益, 有益, 得, ひ益, コンビニエンス, 利合(い), 益, 潤(い), 利養, 便利さ, 分, 利, 余徳, 長, 採算, かい, 強さ, 有利, 実利, 便利, プラス面, バーチュー, バーチュ, 正の側面",,de-DE,ja-JP
erklären,"言う, 申告する, 陳ずる, 声明する, 説(き)聞(か)せる, 言明する, 釈明する, 弁明する, 説く, 説述する, 表明する, 明らかにする, 声明を出す, 解説する, 教える, 表示する, 宣する, 闡明する, 言(い)立てる, 講釈する, 言(い)聞かす, 説明する, 解明する, 含める, 説(き)明かす, 喝破する, 叙説する, 言(い)聞(か)せる, 説き聞かす, 言う, 講述する, 解釈する",,de-DE,ja-JP
ergeben,"恭順な, 従順に, 諦めて, 上る, 忠実な, 誠忠な, 腹心の, ハンブル, 従順な, 伏して, 忠順な",,de-DE,ja-JP
stärken,"堅固にする, 強固にする, 強める, 扶植する, のりをつける, 深める, 強化する, 活気付ける, 強くする, ブースターする",,de-DE,ja-JP
B,"良, B, ビー, ビー",,de-DE,ja-JP
schließen,"終結する, 仕舞う, 終結させる, 推す, かんする, 立(て)切る, 推論する, 閉じる, つむる, 終止する, つぼめる, 臆度する, 推定する, 立(て)込める, 畳む, 閉める, 閉幕する, 閉館する, 閉てる, 論定する, 看板にする, 憶, …を打止めにする, 推(し)量る, 割(り)出す, 結論する, 悟る, 閉業する, うかがう, 塞ぐ, 閉(ざ)す, 引ける, 立てこめる, つぶる, 休業する, 推断する, 取(り)結ぶ, 休館する, 休園する, 閉鎖する, 締(め)切る, 休会になる, 鎖す",,de-DE,ja-JP
Nachfrage,"ニード, デマンド, 必需性, はけ, 足, 売(れ)足, はけ道, デマンド･サイド, 需要, 需要, 売(れ)行(き), ニーズ, ディマンド, 需要量, 深堀り質問",,de-DE,ja-JP
vermeiden,"忌む, 去る, 避ける, 回避する, 外す, 忍ぶ, 嫌う, よける, 忌避する, そらす",,de-DE,ja-JP
1000,"千, M",,de-DE,ja-JP
150,百五十,,de-DE,ja-JP
profitieren,"得する, 利する, もうける, 得をする, 利益を上げる, 恩恵を受ける, 利益を得る, 利を得る, 実を取る",,de-DE,ja-JP
wann,"〈何時〉, 何時, 幾日に, 〈何時〉までに, 何時, 何時に, 〈何時〉何時, 〈何時〉〈何時〉, 〈何時〉かは",,de-DE,ja-JP
Feuer,"火, 紅蓮の炎, かい禄, 火の気, 意気込(み), ファイアー, たき火, 熱気, 火, 火, 祝融, 赤馬, ファイア, 火気, ファイヤー, 意気組(み), 火中, 出火, 火の元, 火の手, 熱血, ファイヤ, 火事, 火災, 火難, 赤猫, 火勢, 八人, 八人童子",,de-DE,ja-JP
Schiff,"シップ, 船舶, 舟, 舟, 船ぼう, 舟船, ネーブ",,de-DE,ja-JP
Brücke,"橋, 橋架, 陸橋, ブリッジ, ブリッジ, ブリッジ, 艦橋, 船橋, くさび, 橋りょう, 船橋楼, 橋, 架工義歯, 陸橋, 架橋結合, 脳橋, 橋架(け)結合, ラグ, ラッグ, 架工歯, 橋義歯",,de-DE,ja-JP
Karte,"図, 線図, 切符, 券, 図面, 菜単, カード, マップ, 伝票, メニュー, プラン, 札, 地図, 紙はい",,de-DE,ja-JP
Zug,"列, 飲(み)口, ライフル, 隙間風, 風, 汽車, 隊ご, 小隊, 列車, 勢(い), 勢(い), 一服, 行進, 傾向, トレーン, 飲(み)口, 行列, 渡(り), 群(れ), トレイン, 索, プラトーン, トラクション, マイグレーション, 旋条, こう線",,de-DE,ja-JP
hauptsächlich,"殊更, 主に, 大方, 殊に, 殊更に, 主, 肝心な, 大体の, 一義的, 主な, 主として, 肝心の, 〈就中〉",,de-DE,ja-JP
Professor,"プロフェッサー, 教授",,de-DE,ja-JP
Betreuung,"小面倒, 養護, 面倒, アテンド, 学生補導, ケア, ケアー, 手入(れ), 受(け)持(ち), 顧(み), 世話, カウンセリング, 面倒見, 観護",,de-DE,ja-JP
besuchen,"臨場する, 台臨する, 来場する, とう, 履修する, 上がる, 足を運ぶ, 参る, まかり越す, 来観する, 出席する, 縦覧する, 来る, 来訪する, 訪れる, 臨席する, 驚かす, 列席する, 見舞う, へいする, 行く, 訪問する, 出る, 訪ねる, 通う, 参上する, 行く, 来聴する, おとなう, 見物する, 伺う, とぶらう, がをまげる",,de-DE,ja-JP
teilnehmen,"名を連ねる, 乗る, 出場する, …に関与する, 加担する, 片棒を担ぐ, 顔を見せる, 携(わ)る, お相伴をする, 仲間となる, 参じる, 参じる, 組する, 参加する, 参列する, あずかる, 相伴する, 顔を出す, 来会する, 出る, お相伴にあずかる, 臨む, 参ずる, 参ずる, 参会する, 参入する, 参与する, 加わる, お相伴する, …に荷担する, 関与する",,de-DE,ja-JP
Rheinland-Pfalz,"ラインラント･プファルツ, ラインラント･ファルツ",,de-DE,ja-JP
Verhältnis,"比, 挨拶, 色恋沙汰, 比率, 割(り), 割合, いき事, 縁, 歩割(り), 比例, つながり, 交渉, 間, 間尺, 形勢, えにし, 相中, 続(き)合い, 分際, 掛(か)り合い, 情事, 間柄, 関係, 関係, 際, 艶事, 係(わ)り, 度合(い), 触(れ)合(い), 色道, 歩合, 係(わ)り合い, 比準, リレーション, 関係性, 愛人関係",,de-DE,ja-JP
kaufen,"購求する, 買(い)上げる, 買う, 買収する, あがなう, 求める, 購入する, 買(い)求める, 取る, 譲(り)受ける, 求む",,de-DE,ja-JP
Risiko,"危なさ, ベンチャー, 剣のん, 危ない綱渡り, 冒険, 危な気, ヴェンチャー, 恐(れ), 危なっ気, 当(た)り外れ, ハザード, リスク, 危険率",,de-DE,ja-JP
Hauptstadt,"京, 都, メトロポリタン, 京華, 京らく, 中央, 国都, 中夏, 京師, 九重, 皇城, 首都, 首府, 都",,de-DE,ja-JP
1993,千九百九十三,,de-DE,ja-JP
Vorstand,"重役会, 役員, チーフ･エグゼクティブ, 頭, 幹事会, 筆頭人, 重役, 役員会, 頭役, 幹部, 理事, 貫首, 会長, 取締役, ボード, ヘッド, 理事会",,de-DE,ja-JP
1994,千九百九十四,,de-DE,ja-JP
Sache,"物件, 案件, 物, 実物, 段, 段, 事故, 事柄, 事項, くだん, 用, 問題, 物事, 事, 件, 用件, 訳, 本案, 物品, 奴, マター",,de-DE,ja-JP
Feld,"野面, 田ぽ, 陸田, 場, 場, 畑, 園, 園, 畑, ほ場, 野, 田地, 田畑, 小野, 野辺, 田代, 代, 田畑, 田地, 目, 原頭, 戦場, 原野, 野外, 田畑, 野原, 領域, 野, 分野, ごう間, ほ, 目, 原, {野良}, 野中, 集団, フィールド, 作場, 農ほ, 野(っ)原, 田ばく, 白田, 白田, 領野",,de-DE,ja-JP
Partie,"音部, 手合(わ)せ, 対戦, ロット",,de-DE,ja-JP
beendet,"済(み), 終了した, 終わった",,de-DE,ja-JP
Demokratie,"デモクラシー, 民主国, 民本主義, 平民主義, 民主主義, 民主国家, 民主制, デモクラシー国家",,de-DE,ja-JP
Meister,"名工, 使(い)手, 師家, アルチスト, チャンピオン, 名人, 頭, 名手, ひじり, 抱え主, 範士, 覇者, 目玉, 親方, {猛者}, 先生, 先生, ボースン, 家元, 大じょう, 大家, 一家を成した人, 王者, 優勝者, 王者, 坊主, 坊主, 達人, 剛の者, {玄人}, 師, 師, 妙手, アーチスト, 大所, 宗匠, 師匠, アーティスト, 一家, 高手, 雇(い)主, マイスター, おっしょさん, メートル, 腕達者, 業人, おっしょうさん",,de-DE,ja-JP
eingeführt,"伝来の, 舶来の",,de-DE,ja-JP
Park,"園, 園, パーク, 園, 園, 庭園, 朴, 朴",,de-DE,ja-JP
Lehrkräfte,教職員,,de-DE,ja-JP
Gott,"天, 上天, デウス, ゴッド, 全父, 創造主, 天帝, 上帝, 神様, 父, 神明, 天父, アラー, 〈大宇須〉, 神, カムイ, 神, 天主, 比古神",,de-DE,ja-JP
Geschäftsführer,"幹事, 業務執行者, 事務長, 経営者, 営業者, 番頭, 営業主任, 主事, 管理者, 元締(め), 経営管理者, 執行役, 企業経営者, 経営責任者",,de-DE,ja-JP
weg,"…から離れて, から, 離れて, ぼやっ, ぼけっと, ぼけっ, なくなった, ぼやっと",,de-DE,ja-JP
vergeben,"宥恕する, こたえる, 容赦する, 勘弁する, くれる, 許す",,de-DE,ja-JP
Macht,"威勢, 押(さ)え, 権能, 羽振(り), 手の内, 権, 権力, パワー, 威, 強力, 勢(い), 勢(い), 勢(い), 勢(い), フォース, 影響力, 丈, 威力, 権威, 権勢, 勢力, 力, 雄視, 威権, 権柄, 有力, 勢威, 多力, 偉大さ",,de-DE,ja-JP
Mieter,"たな子, 借(り)手, 間借り人, 借家人, テナント, 借(り)主, 借(り)受(け)人, 賃借人, 借家人, 入居者",,de-DE,ja-JP
John,ジョン,,de-DE,ja-JP
Minute,"分, 分",,de-DE,ja-JP
Personal,"人員, 乗務員, 兵員, 勤務者, マンパワー, 職員, 乗員, スタッフ, 部下, 手駒, 使用人, 従業員, 部員, 顔触(れ), 人件, 用務員, 人的資源",,de-DE,ja-JP
1992,千九百九十二,,de-DE,ja-JP
Nachfolger,"継嗣, 追随者, 継承者, 跡取(り), 後釜, 後進, 後継者, 継(ぎ)手, 後任, 嗣, 後嗣, 後任者, 後, 世継(ぎ), 跡継(ぎ), 後者, 後継機種, 信従者, 後継機, 後進者, 承継者, 承継人, 後継ソフト",,de-DE,ja-JP
Staatsanwaltschaft,"検察庁, 検, 検事部",,de-DE,ja-JP
1989,"千九百八十九, 平成元年",,de-DE,ja-JP
überzeugt,"しゃっきり, 確信した, しゃっきりした, 確信をもって",,de-DE,ja-JP
Garten,"園林, 庭, 園, 園, 園庭, 園, 園, 庭園, ガーデン",,de-DE,ja-JP
verfügbar,"使用可能な, 利用できる, アクセシブル",,de-DE,ja-JP
Hof,"庭, 邸内, 内庭, うん, 農場, 光環, コート, コート･ヤード, 中庭, ヘイロー, ハロー, 朝, 殿上, びょう堂, かさ, ハロ, 光暈",,de-DE,ja-JP
niemand,"誰でも, 何人, 誰も, 誰しも, 人っ子{一人}, だれも…ない, 誰にも",,de-DE,ja-JP
Service,"接客態度, 客扱(い), サービス, サービス, セット, サーヴィス, サーヴィス, 便, 運行, 食器, 客あしらい",,de-DE,ja-JP
Design,"図様, 工匠, 設計, ディザイン, 絵柄, 図案, 趣向, たくみ, 意匠, 図柄, 模様, 柄合い, スタイル, スタイル, 柄, デザイン",,de-DE,ja-JP
möglicherweise,"事に依ったら, 若(し)くは, 若(し)くは, かも知れない, 大方, 多分, ひょっとしたら, ことによると, ともすると, …しれない, けだし, もしかしたら, ひょっとして, まず, 恐らく, かも知れません, 有(り)得べき, …やも知れぬ, …やも知れず",,de-DE,ja-JP
stammen,"根差す, 来る, 発する",,de-DE,ja-JP
Bestandteil,"成(り)立(ち), 種, 構成要素, コンポーネント, 成分, 構成物質, 付(き)物, 合成分, 構成分子, 含有成分, アイテム, 構成成分",,de-DE,ja-JP
Jungen,ボーイズ,,de-DE,ja-JP
Verständnis,"見識, 疎通, 降心, わきまえ, 意, 会心, 見解, 通じ, お通じ, 納得, 理会, 鑑賞, 悟り, き知, 明, 物分(か)り, 情け心, 理解, 自得, 分(か)り, 理解力, 合点, 会得, りょう, 情合(い), 読(み), 認識, 情(け), 察し, 心得, 把握力, パーセプション",,de-DE,ja-JP
Kommission,"委員会, 評議会, 歩割(り), コミッション, 口銭, 歩, コンミッション, 委託, ボード, 歩合",,de-DE,ja-JP
dahin,"あそこに, そちらに",,de-DE,ja-JP
verstärkt,裏打(ち)した,,de-DE,ja-JP
Müller,"粉屋, 製粉業者",,de-DE,ja-JP
Vorhaben,"計画, 積(も)り, 挙, 機軸, 目ろみ, ちゅう略, 企て, 意, 心掛(け), たくらみ, 結構, 結構, 腹積(も)り, 意中, 意図, 企図, 了見, 意志, 意向, 方針, プラン, 抱負, はかりごと, 心組み, 腹案, 心算, 企画, 案, 意企, 思い, 意思, 予定, 画策, インテンション, 計策",,de-DE,ja-JP
Behinderung,"妨害罪, オブストラクション, お邪魔, 不自由, 妨害, 妨げ, 壊(し), 構い, 事故, 邪魔, インターフェアランス, 故障, 障(り), 阻止, 足障り, きはん, 邪魔立て, 進路妨害, インターフェランス, ディスアビリティー",,de-DE,ja-JP
anhand,手掛(か)りに,,de-DE,ja-JP
Termin,"時日, 期日, ターム, 日限, 期限, アポイントメント, 確定日付, 時間, 年限, 期, 時限, アポ, 日々, 日時, 日取(り)",,de-DE,ja-JP
Quellen,"膨潤, スエリング, スウェリング",,de-DE,ja-JP
plötzlich,"ころっと, 突然に, ぱっと, 急に, ひょっくり, 瞬く間, ぬっと, ころりと, 行(き)成り, 行(き)成り, たちまち, 唐突, にわかの, とみに, ぱたっと, ぶっつけに, くるっと, ぱたっ, ひょいと, 唐突に, むっくり, ぼっかり, 翻然, ばったり, 翻然として, くるりと, 突如, 矢庭に, ふいと, ふと, すっくと, 急激に, 突然の, はっと, 出(し)抜(け)に, ひょっこり, ひょい, 勃然として, 短兵急, 足下から鳥が立つように, 勃然, どっと, 率然, 勃然と, 突発的, 唐突な, けろり, がぜん, さっと, がばっと, 降って湧いた, 時ならぬ, 突発的な, ふっ, 行(き)成(り), 行(き)成(り), くるり, 突如として, がらりと, 打付け, 不意の, 急激な, かつ然, ついと, ころり, つと, 不慮の, がらり, 短兵急な, こつ然と, 突発的に, ふっと, 急な, やぶから棒に, ぴたり, こつ然, どっ, ばく然, 一躍, ぱったり, 不意に, かつ然たる, こつたる, ぬうっと, にわかに, 突然, ぽっくり, かつ然と, とっさに, ばっと, にゅっと, ばっ, むっくと, 手の裏を返すように, すっと, ほっかり, 短兵急に, にわか, ぽっと, さあっと, がば, ぷいと, あわやと見る間に, がくんと, ぱっ, けろりと, ばく然と, くるっ, すうっと, 急の, 瞬く間, きょ然, 不意と, どんと, ぴたっと, 瞬く内, ばく地, かくん, かくんと, かっくん, かくっ, かくっと, がくん",,de-DE,ja-JP
Formen,"挙止, 造形, モールディング, フォーミング, 塑造",,de-DE,ja-JP
breit,"太い, 洋々たる, 幅広い, ワイド, ワイド, 広く, 洋々, 広範な, 厚い, 幅の広い, でかでかと, 洋々とした, 広, 長々, 広幅な, 広い, でかでか, 広範に, ぶっとい",,de-DE,ja-JP
45,四十五,,de-DE,ja-JP
Max,マクス,,de-DE,ja-JP
Wetter,"日, 天候, 陽気, 天色, 天気, {日和}, ウエザー, 空合(い), 空模様, 気象, お天気, 空色, 空, 時候, お天気コーナー",,de-DE,ja-JP
Anlagen,"地覆, 機械類",,de-DE,ja-JP
Werte,価値観,,de-DE,ja-JP
Herausforderung,"挑発, チャレンジ, 挑戦, 挑戦試合, 臨み",,de-DE,ja-JP
Infrastruktur,"インフラストラクチャー, インフラ",,de-DE,ja-JP
international,"国際的に, 万国, 国際間, 国際的な, 国際的, 世界的, 世界的な, インターナショナル, インターナショナル, 国際, 国際, 国際の, インター, インタナショナル, インタナショナル",,de-DE,ja-JP
Autor,"著作家, 作家, 創作者, 執筆者, 表現主体, 著作家, せん者, 文筆家, 著者, 作者, 筆者, 著作者, ライター",,de-DE,ja-JP
Tat,"所為, 仕事, 業, 行為, 事績, 所行, 犯行, 行(な)い, 事, 仕業, 所在",,de-DE,ja-JP
schreiben,"書き物をする, 草する, 申(し)送る, 興す, ペンを執る, 書ける, 書(き)下ろす, つづる, 創作する, 字を書く, 書する, 染筆する, 執筆する, 表す, 打つ, 筆を執る, 書(き)記す, 賦す, 載せる, 作成する, したためる, 筆を運ぶ, 文章を書く, 寄せる, 著(わ)す, 賦する, 駄文を書く, 書く, 筆硯に親しむ, 稿する",,de-DE,ja-JP
Geräte,"什物, エキップメント, エクイップメント",,de-DE,ja-JP
Voraussetzung,"事前に必要, 要項, 仮定, 条件, 前提, 前提条件, 地, 要求事項",,de-DE,ja-JP
28,二十八,,de-DE,ja-JP
Inhalt,"内容, 本文, 筋, 意, 意味, 素材, 含有率, 含量, 本文, 成分, 含有量, 概, 趣旨, 趣, 中身, 旨, 実, コンテンツ, 実質, 入(り), 目次, 内容物, コンテント, 旨帰",,de-DE,ja-JP
zugänglich,"取っ付きやすい, 近付きやすい, 近付きやすい, 人懐こい, 親しみやすい, 付き合いやすい, 手の届く, アクセシブル",,de-DE,ja-JP
Szene,"シーン, 場, 場面, 光景, 風景, 口論, 一こま, 景, 景観, 一場面, 場景, 情景, 乱痴気騒ぎ, 寸景, 情景法",,de-DE,ja-JP
Details,"詳しい事, こさい, 子細, 細かい事, 機微, 巨細, 経緯, 委しつ",,de-DE,ja-JP
höchste,最高,,de-DE,ja-JP
