FrontText,BackText,Comment,FrontTextLanguage,BackTextLanguage
Verwaltung,"管理局, 統轄, 切(り)回し, 運営, 事務, 取(り)締(ま)り, 政, 管掌, 政府, 切(り)盛(り), 司宰, 経りん, マネージ, 経理, 管領, 行政府, 掌理, 政道, 支配, 管財, 治, 行政, 統括, 主管, 統御, 主宰, 治政, 総轄, 主管機関, アドミン, 経営, 事務局, 管理, エグゼクティブ, 政治, 官憲, 差配, アドミニストレーション, アドミ",,de-DE,ja-JP
Kopf,"首, 頭部, 頭部, 頭脳, 小首, 頭, 素首, ボス, 頭, 素っ首, つぶり, 元, おつむ, かさの台, 上, こうべ, 大将軍, ヘッド, 先, かぶり, つむり, 表題, 知のう, 大将軍, なずき, どたま, 天窓, 天々, プリアンブル",,de-DE,ja-JP
links,"左翼的, 左に, 左に当たって, レフト, L, 左, 左舷側に, 左の, 左傾した, 下手の, 左側に",,de-DE,ja-JP
bilden,"形成する, 作(り)出す, 成す, 仕立てる, 結成する, こしらえる, 工作する, 形作る, 形作る, 作る, 構成する, 造形する, 生成する, 編成する, 訓育する, 組む",,de-DE,ja-JP
Wochenende,"土日, 週末, ウィーク･エンド, ウイーク･エンド, 土日曜日",,de-DE,ja-JP
Ausland,"外地, 唐, 唐, 異郷, 外邦, 遠国, 外国, 異邦, 外土, 絶域, 向(こ)う, 異朝, 外い, 海外, 異域, 〈彼方〉, 異境, 異国, とつくに, 唐, 蛮, 国外, 殊俗, 海彼",,de-DE,ja-JP
Abend,"夕間暮(れ), 夕刻, 日暮(れ), 日暮(れ), 入(り)相, 夕さり, イブニング, 暮夜, 宵, 夕暮(れ), 夜分, 晩, 日暮, 夜, 夕景, 日暮(れ)方, 夕べ, 暮(れ)方, 夕, 夕日, 夕方, 晩刻",,de-DE,ja-JP
Monat,月,,de-DE,ja-JP
Studie,"下絵, 論考, エスキッス, エスキス, 点描, エチュード, アルバイト, 習作, 試作, エスキース",,de-DE,ja-JP
Zeitung,"ガジェット, ガゼット, 新聞紙, プレス, 新聞",,de-DE,ja-JP
zwölf,"十二, トゥエルブ",,de-DE,ja-JP
sorgen,"手掛ける, 計(ら)う, 気配りをする, 世話をする, 煩う, 慈しむ",,de-DE,ja-JP
Dorf,"里, 村里, 農村, 村, 村邑, 村落, りょこう, ざいご, ひな, 郷村, 郷ゆう, ビレッジ, 郷里, 在郷, ヴィレッジ, 郷村, 人里, 村, 一里, コタン, ゆう落, ゆう里",,de-DE,ja-JP
Produktion,"産出額, プロ, 産生, 出来高, 作り高, プロダクション, 作品, 製出, 産出, 作製, 生産, 製作, アウト･プット, 産, 製造, メイキング, メーキング",,de-DE,ja-JP
Martin,"マルティン, マルチン",,de-DE,ja-JP
24,二十四,,de-DE,ja-JP
Herbst,"秋場, 秋期, 秋, 秋季, 白帝, オータム, 商秋, 白秋, 素秋, 素商",,de-DE,ja-JP
Beratung,"ガイダンス, 評議, コンサルティング, 審議, 諮議, 相談, 会議, 協, 議事, 指導, 工面, 補導, 謀議, 詮議, 顧問, 顧問, 諮問, 協議, 議, 談義, しじゅん, 会談, カウンセリング, 評定, 打(ち)合(わ)せ, 相談会, コンサル",,de-DE,ja-JP
Druck,"映(り), 圧力, 版画, 印刷, 版, 圧迫, 印画法, 切迫感, 負担, 刷(り), 強制力, 強圧, 締(め)付け, 刷(り)上(が)り, 圧搾, 本刷(り), 強制, 圧, 押し, 押し, プリント, プリント",,de-DE,ja-JP
Chance,"因縁, 機, 縁, 隙, 間合(い), 機会, えにし, 浮(か)ぶ瀬, チャンス, 可能性, 契機, 機宜",,de-DE,ja-JP
Wissen,"承知の助, 心当(た)り, 承知, 拝承, わきまえ, 見聞, 存知, 知見, 存知, 聞知, 識, 見聞, 知得, 御存じ, 知識, 覚悟, 存, 見聞(き), 学, エピステーメー, ナレッジ, ナリッジ, ノリッジ, ノレッジ",,de-DE,ja-JP
Verwendung,"用い方, 利き, 適用, 用法, 使い道, 使用, 用途, 御利用, 実用, 活用, 利活用",,de-DE,ja-JP
Stück,"トラック, 切(れ), 切(れ), 石, 個数, スライス, 切片, ピース, ドラマ, 演目, 固まり, 作品, か, 個, 個, ちょう, ちょう, ちょう, ちょう, ちょう, ちょう, じょう, じょう, じょう, じょう, じょう, じょう, 切(り)身, 曲目",,de-DE,ja-JP
Staaten,"列国, 邦国",,de-DE,ja-JP
warum,"どういう理由で, 〈何故〉, あに, 〈如何〉でか, どういう訳で, 何で, 〈如何〉して, どういうわけで, 何故, なして, 〈何故〉に",,de-DE,ja-JP
Krankenhaus,"病舎, 病院",,de-DE,ja-JP
Energie,"エネ, 精根, 気合(い), 精気, 英気, 気力, 精分, 勢(い), 勢(い), エナージー, エナジー, 精力, 元気, 張(り), 張(り), 精, エネルギー, エネルギー, 活動力, 勇(み)",,de-DE,ja-JP
Google,"グーグル, ググル",,de-DE,ja-JP
Einfluss,"影響, 威勢, 押(さ)え, 反響, 顔, 光, 光, 羽振(り), プレゼンス, 働(き)掛(け), 手の内, 権, インフルーエンス, 発言力, 権力, 威光, 威, つて, 勢(い), 勢(い), フォース, 影響力, 威力, 感化, 響(き), 加減, 加減, 加減, 加減, にらみ, 権勢, 重き, 勢力, 力, 幅, 関係, 押し, 重し, 手引(き), 係(わ)り, 権柄, 有力, 勢威, 多力, インフルエンス",,de-DE,ja-JP
Idee,"計略, 存(じ)寄(り), 考(え), 精神, 謀(り), 意, 意味, 念, インスピレーション, 一案, アイディア, アイディア, 発案, 所思, 理念, イデー, 才覚, 意見, 考案, インスピレイション, イデア, 工夫, 趣向, 意匠, 表象, 思い付(き), 観念, 発想, 案, コンセプション, 思い, 意思, 思想, アイデア, アイデア, 着想, 想",,de-DE,ja-JP
Spielen,"〈博奕〉, ばくち打ち, プレイ, ギャンブル, 遊戯, たわぶれ, プレー, 遊(び), 手遊(び), 手すさび, 博えき, 手慰み, 戯れ, ゲーミング",,de-DE,ja-JP
Teilnahme,"列席, 参入, 相伴, 出場, 熱心, 片棒, 感興, 参会, 推察, 繰(り), パーティシペーション, 気, 参与, お相伴, 篤志, 同情, 関心, 出席, 素っ気, 痛よう, 関与, 弔慰, 来会, 掛(か)り合い, 配慮, 配意, 参列, 陪席, 関係, 共感, 荷担, 察し, 参加, 係(わ)り合い, 共犯関係, 共感共苦",,de-DE,ja-JP
enthalten,"帯びる, 入る, 包容する, 含む, 含む, 含有する, はらむ, 包含する, 込める, 包蔵する",,de-DE,ja-JP
Tätigkeit,"活動, 幹, 営為, 働(き), 機能, 運転, 事, アルバイト",,de-DE,ja-JP
EU,"欧州連合, ヨーロッパ連合, EU",,de-DE,ja-JP
Verantwortung,"任, 責(め), 担当, 責任, 役柄, 責任感, 答責, 罪, 罪, 責務, 担任, 肩, 担当項目, レスポンシビリティー",,de-DE,ja-JP
komplett,"丸々, 丸々, ずぶ, 完膚無きまで, まんまんと, コンプリート, コンプリート, ぴたり, そろった, うまうまと, ずぶの, ぴったり, まんまと, ぱねぇ, 全的, 半端なし, 半端無い, ぴったし",,de-DE,ja-JP
außerhalb,"外で, …外, 外に, オフ･サイト",,de-DE,ja-JP
Liebe,"愛恋, 慕情, カリダーデ, メイク･ラヴ, 愛情, 恋慕, 愛着, 愛玩, 意, 愛念, 仁慈, 意気込(み), アムール, 愛好, かわいさ, 恩愛, ひいき, 恋心, 恩情, 慈しみ, 恋路, 楽, 情愛, 恋愛, 愛楽, 愛着, 恩, メイク･ラブ, 愛, 好意, 意気組(み), 恋気, 色恋, 親愛, 恋, 愛ちょう, 恩愛, ちょう愛, 色, 愛心, 世の中, 恋情, 思い, ラブ, 情(け), 色道, 雲雨, いとしさ",,de-DE,ja-JP
Körper,"く, く, 体, 体, 骨肉, こく, ボジー, ボディ, 御身, ボデー, く体, 肉塊, 形, 物, 肌身, 血肉, 身, 皮肉, 皮肉, 立体, ボジイ, お身, 物体, 髪膚, 身体, 立体図形, 肩身, 本体, むくろ, 肉体, ボデイ, 体, ボディー, 胴体, く幹, く, ししむら, 空間図形, 骸く, 肉塊, 肉身",,de-DE,ja-JP
Technik,"技法, 工学, エンジニアリング, 方術, 幹, テク, テク, 工, 工, 手法, テクニック, 技巧, 工業, メカニック, 技, 技, 技術, メカ, 芸術, 工芸, 術",,de-DE,ja-JP
Funktion,"機, 能, 関数, 働(き), 作用, ファンクション, 役儀, 機能, 役目, つかさ",,de-DE,ja-JP
informiert,"多識な, 多識の",,de-DE,ja-JP
selten,"得難い, 新奇な, たぐいまれな, 凡ならざる, 少(な)い, 珍な, まれな, たま, たまさか, 希代の, 有(り)難い, 希少な, 殆ど…ない, 滅多に…で無い, 滅多に…無い, まれに, 珍しい, ほとんど, ほとんど, りょうりょう, たまの, 偶, け有の, たまに, 時たま, 時によると, 物珍しい, 滅多に, まれ, 数少ない, 珍しき, レア, たぐいまれ",,de-DE,ja-JP
Kampf,"戦闘, 攻防, 闘じょう, 交戦, 陣, 顔合(わ)せ, 闘争, 取(り)組(み), バトル, 合戦, ファイテイング, 干か, ファイト, ファイト, ファイティング, 軍立(ち), いがみ合い, 争奪戦, 事件, 争闘, 対戦, 対戦, 戦(い), 戦(い), 会戦, 弓せん, 事, 弓矢, 争奪, コンバット, アウティング, 渡り合い, 闘戦, ストラッグル, ストラグル, 格闘戦",,de-DE,ja-JP
Studierende,"男子及び女子学生, 女子大生, JD, 女子大学生",,de-DE,ja-JP
Gesetz,"典章, 令, 法律, 定(め), 法, 数, 律, おきて, 基準法, 法典, のり, 法則, 理法, 儀軌, 法条",,de-DE,ja-JP
dennoch,"いえども, それでいて, それにもかかわらず, しかも, だけども, その癖, だが, …すると言えども, だけれど, …といえども, それにしても, だけど, だけれども, かかわらず, されど, されども, やけど",,de-DE,ja-JP
brauchen,"要る, 事欠く, 入り用である, 用いる, 要する, 掛(か)る, 必要とする, 取る, 事を欠く",,de-DE,ja-JP
Ausstellung,"展覧会, 陳列, 展示, エクジビション, 交付, サロン, エキジビジョン, 博覧会, 見世物, 興行物, 出陳, 出品, フェア, 出展, 品評会, エキシビジョン, …展, 展観, エキシビション, エキジビション, 発行, 展示会, 陳列会",,de-DE,ja-JP
Christian,クリスティアン,,de-DE,ja-JP
entscheiden,"取りさばく, 処断する, 決する, 取りまとめる, 審判する, 白黒をつける, 審判を務める, する, 議決する, 決定する, 黒白をつける, 一決する, 確定する, 裁決する, 一定する, 決める, 決める, 踏(み)切る, 評定に掛ける, 腹を決める, 表決する, 判定する, 決まりをつける, 決裁する, 裁定を下す, 窮める, 据える, 決断する",,de-DE,ja-JP
grundsätzlich,"主義として, 原則として, 原則的な, ア･プリオリ, 基本的には, 原則的",,de-DE,ja-JP
Auswahl,"選択, ドラフト, セレクト, 書(き)抜(き), 盛(り)合(わ)せ, 選択語, とうた, 選抜チーム, より抜き, 選定, 選出, ダイジェスト, 粒より, えり抜き, 選み, 選挙, 見出(し), 選抜, 抄, 選別, 抜粋, 選良, 簡抜, セレクション, 見立(て), 選び, 選考, 選, 取捨選択, えりすぐり, チョイス, 抜てき, 抄録, 品ぞろえ, 簡択, セレソン, アソートメント, せん定, せん",,de-DE,ja-JP
Anlage,"素養, 添付書類, 装置, 添書, 同封物, 下地, 出資, 設備, アタッチメント, 施設, レイ･アウト, 同封書類, 器量, 傾向, 素質, 別紙, 投入, たち, セット, 天分, 能力, ファシリティー, 添付, 素因, 原基, レー･アウト",,de-DE,ja-JP
geschlossen,"閉鎖的な, 一丸となって, 非公開の, 気をそろえて, 緊密な, クローズド, きゅう然, 閉, 閉, 閉鎖的",,de-DE,ja-JP
darum,"それだから, その故をもって, ですから, されば, それゆえ, しかれば, 従って, …に従って, そこで, …て, さてこそ, だから, このために, なのです, ですので, なので, このため, これだから, そのせいで",,de-DE,ja-JP
1945,千九百四十五,,de-DE,ja-JP
offenbar,"歴然とした, 較, れっきとした, 見るからに, 目立って, 歴然として, 明らか, 歴然, 表向き, 歴然たる, 顕示的, 顕在的",,de-DE,ja-JP
Norden,"ね, さく北, ☵, 北部, 北方, 北",,de-DE,ja-JP
Fläche,"平原, 曲面, 平(ら), 面, 広さ, 平地, 面積, 広ぼう",,de-DE,ja-JP
länger,"もっと, より",,de-DE,ja-JP
rechts,"右舷の方向に, 右方の, 右側に, 右に, 右, ライト, 右手, 右派の, 右舷に",,de-DE,ja-JP
unterschiedliche,"各種, 千々",,de-DE,ja-JP
verheiratet,"夫婦の, 結婚生活で, 既婚の, 有夫の身で, 有夫の",,de-DE,ja-JP
Anschluss,"端子, 接続, コネクタ, コネクター, 乗(り)継(ぎ), 接続口, キャッチ･アップ, 連結, 連絡, 獨墺合邦, フォロー･アップ, オーストリア併合, アンシュルス, オーストリア合邦, インスタレーション, インストレーション",,de-DE,ja-JP
11,イレブン,,de-DE,ja-JP
Museum,"ミュージアム, 博物館, 資料館, 絵画資料館",,de-DE,ja-JP
Kommunen,市町村,,de-DE,ja-JP
künftig,"じ後, 将来は, 向後, 今後, 向後, 向後, これから, 自今",,de-DE,ja-JP
beachten,"顧(み)る, 厳守する, 用いる, 気に留める, 振(り)向く, 遵奉する, 奉じる, 注目する, 循守する, 順守する, 奉ずる, 顧慮する, 気を払う",,de-DE,ja-JP
Einrichtung,"装置, 家具調度, インスティチューション, 制度, 整頓, 備品, 設定, 繰(り)合((わ)せ), 設備, 施設, 設置, 造作, 設営, 備(え), 装具, 取(り)付(け), 機関, ファシリティー, 調度品, 調度, 備(え)付け, インスティテューション, しつらい, しつらえ, 家具類",,de-DE,ja-JP
Lösung,"解式, 液, 解決, 出口, 解決法, 縁切(り), 収(ま)り, 解消, 手切(れ), ソリューション, ソリューション, 解答, 落着, 氷解, 解決策, 溶液, 打開, 答(え), キー, 鍵, 心, 解法, 溶解液",,de-DE,ja-JP
Auftrag,"下命, 使命, 発注, 嘱託, 請負, 委任, 任務, 依頼, 依, 担当, 注文, 塗(り), 課題, ミッション, 頼(み), 用命, 用, 委嘱, 委託, 御用, 頼み事, 御用命",,de-DE,ja-JP
Mensch,"人類, 仁, 人物, 人間, マン, 人, 人, ホモ, 人っ子, 人, 有生, 人の子, ぼっち, ぼっち, 生物の霊長, パーソン, パースン",,de-DE,ja-JP
Süden,"南, うま, みんなみ",,de-DE,ja-JP
Hintergrund,"バック, 後景, 意味合(い), 書(き)割(り), 背後, 背景, 背景, 裏側, バック･グラウンド, 裏事情",,de-DE,ja-JP
Führung,"ガイダンス, 引率, アヘッド, 誘えき, 操縦, 誘導, 導(き), 道案内, 弁理, 主導, 切(り)回し, 運営, 宰領, 指揮, 護輪軌条, 切(り)盛(り), 指導, 首脳部, 御案内, 支配, リーダー･シップ, 取(り)計(ら)い, 案内, 脱線防止ガード, 幹部, リード, 統率, 主宰, 引(き), きょう導, 身持(ち), 統裁, 主事, 先導, 行跡, 護輪レール, 引(き)回し, 手引(き), 管理, 先, 牛耳, 風び, 素行, リーディング, ガバナンス, 行跡, ディレクション, ガイド・ツアー, 前導, 首脳陣, リーディング･エッジ",,de-DE,ja-JP
2001,二千一,,de-DE,ja-JP
Video,"ビデオ, VTR, ヴィデオ, 映像, VTR",,de-DE,ja-JP
Runde,"見回(り), 巡回, ラウンド, 周, 一回(り), 節, 回, 巡(り), 周回, ラップ, レッグ, レグ",,de-DE,ja-JP
alt,"中古, 老けた, かび臭い, 昔からの, 味の抜けた, 陳た, 年取った, 年寄(り)の, 旧の, 古くからの, 古めかしい, 年を取った, 古来の, 古, 昔の, 旧来の, 中古の, 月遅れの, 古い, 中古の, 古ぼけた, 長寿の, 上古の, 古き, 上, 古の, 古の, 古色そう然たる, 老いたる, オールド",,de-DE,ja-JP
Alltag,"日常生活, 平常, 日常, 行住ざが, 実生活, 平日, 不断, 起が, 例日, 一般生活",,de-DE,ja-JP
Arten,品類,,de-DE,ja-JP
völlig,"ころっと, 一に, ころりと, 段段乎たる, 丸々, 丸々, ぞっこん, ぞっこん, もはら, 見事, 土台, 土台, 丸っ切り, 十分, 真個の, だんだんこ, 奇麗な, 万事に, すっかり, すっかり, すこぶる, とっぷり, 見事な, 丸ごと, たっぷり, 丸切り, 〈一向〉, がらりと, 十分な, ずぶ, ころり, 頓と, またく, 奇麗に, 全て, すっぽり, まるで, どっぷり, 残るくまなく, 一杯, 一杯, 全く, ずぶの, 何となく, 一切, 台無し, 台無し, まったくの, 全くもって, 有無に, がらっと, 全き, どうもこうも",,de-DE,ja-JP
welcher,"いずれ, 何, どれ, なあに, 何, どの, 〈何方〉, いずれは, 〈何方〉, 誰, たれ, た",,de-DE,ja-JP
König,"大王, キング, 覇王, 夫王, 王, 王, 王様, 君主, 玉将, 父王, 王者, 国王, 王者, 国主, 王将, 帝王, 君, 君, 玉, 上一人",,de-DE,ja-JP
vorhanden,有りき,,de-DE,ja-JP
19,"十九, 十九",,de-DE,ja-JP
Wort,"ワード, 発言, 言, …語, 言, 言(の)葉, 通り言葉, 語, ロゴス, 発言, ハーフ･ワード, 言葉, 単語, スピーク",,de-DE,ja-JP
Gericht,"公判廷, エッセン, 司直, 裁判所, 裁判, 料理, 訟廷, 法廷, 裁き, 膳部, 公廷",,de-DE,ja-JP
Trotz,"ふてくされ, 抵抗, 駄々っ子ぶり, 利かん気, 駄々, 利かぬ気",,de-DE,ja-JP
wiederum,"再度, さてまた, 両度, 更, 更に",,de-DE,ja-JP
Schloss,"シャトー, 城, 宮殿, 貝のちょうつがい, 御殿, お城, 丸, ロック, 城, 屋形, 宮, 錠前, 錠, 錠, 城郭, 楼閣, 殿宇, 殿上, 大殿, 鍵, 館, ぐすく, 殿, 御舎, 銃機, キャッスル, 城館",,de-DE,ja-JP
Austausch,"イクスチェンジ, 取り替えっこ, 入(れ)替(え), エクスチェンジ, 授受, 貿, 引(き)換え, 交流, 交易, 差(し)替え, やり取り, 置換, 置換, 交換, 迭, 換置, サブスティテューション",,de-DE,ja-JP
fördern,"振興する, 主唱する, 助長する, 産出する, 賛助する, 推進する, 下支えする, 採取する, 奨励する, 育成する, てこ入れする, かん養する, 増進する, のし上げる, 進める, 引(き)立てる, 運ぶ, 助ける, 発起する, 促進する, 登用する, 便を図る, 手に負える",,de-DE,ja-JP
Umgebung,"境遇, 近回り, 側辺(り), 四方, 近辺, 居回り, エンバイロメント, 界わい, 辺り, 地方, 環境, 近隣, 取(り)巻(き)連, 取(り)巻(き), 周(り), 近在, 回り, 辺, 周辺の地, 巡(り), 外辺, 周回, 四囲, 周囲, 付近, 近傍, 外周, 周辺地区, 周辺地域, ミリュー, ネイバーフッド",,de-DE,ja-JP
9,"九, ナイン",,de-DE,ja-JP
Dienst,"出番, 当直, 奉仕, 業, 用役, 役, 業務, 勤め向き, 当番, サービス, サービス, 用務, 労務, 貢献, 奉公, 職分, 服務, 番, 勤め, 職務, 公務, 使役, 役, サーヴィス, サーヴィス, 役務, 年季, 仕, お勤め, 運行, 勤務, 本分, 業",,de-DE,ja-JP
ziehen,"ひりひりする, 延伸する, 張(り)渡す, 引く, 控える, 控える, 引(っ)張る, 培う, 指す, ドラッグする, はわせる, 引(き)当てる, 引(き)渡す, 援, 振る, 抜去する",,de-DE,ja-JP
Tor,"たつ, 門口, ゲート, ゲート, 馬鹿, フープ, おどけ, 痴人, 門, 門, 走り出, 木戸, しれ者, 旗門, 入(り)口, 愚者, ゴール, ばっか, 痴漢, ゴール･イン, 弾, 関門, 入(り)口, 点, 〈白痴〉, トーア, トール",,de-DE,ja-JP
Bank,"ベンチ, 銀行, 長椅子, 長椅子, 腰掛(け), 親, 縁台, バンコ, バンク, 金庫, 銀行遊び",,de-DE,ja-JP
80,八十,,de-DE,ja-JP
Mehr,おまけ,,de-DE,ja-JP
verantwortlich,責任のある,,de-DE,ja-JP
Bund,"盟約, 束, ユニオン, 外灘, 団結, フレット, 結束, 契約, 同盟, 連盟, 連合, 結社, じゅう",,de-DE,ja-JP
Zahlen,数字,,de-DE,ja-JP
gestalten,"成形する, 形成する, 形作る, 形作る, 作る, 造形する",,de-DE,ja-JP
A,"A, あ, アンペア, アルファ付き, 甲, AMP, アルファ, イ, イ調, A, 阿, アンペヤ",,de-DE,ja-JP
Israel,イスラエル,,de-DE,ja-JP
Standort,"立(て)所, 衛じゅ, 立場, 衛じゅ地, 位地, 所在地, 駐屯地, 駐在, ロケーション, ベース･キャンプ, 位置, 位置の査定, 視座, 向(き), 立地, 所在, 駐さつ, 自生地, 原生地",,de-DE,ja-JP
Mittel,"〈方便〉, メディアン, 具, 具, 方法, 業, メディア, 手, 中数, 出(し), 〈方便〉, 踏(み)台, 半(ば), 薬, 途方, 手段, 資産, すべ, 中間, 仕方, 方策, よすが, 手立(て), 武器, 道, 工夫, 致(し)方, 〈方便〉, 方途, 詮, 平均値, 方略, 力, 金, イングリッシュ, 薬剤, 平均, 由, 剤, 術, ヤク, 中央値, やりよう, 作用薬, ミーンズ, ミーンズ, メジアン, メディウム",,de-DE,ja-JP
Künstler,"作家, 芸能人, アルチスト, 芸術家, 演者, 細工人, 画伯, 作者, アーチスト, 文化人, 演者, アーティスト, 実演家",,de-DE,ja-JP
Westen,"西方, とり, W, 洋, 西洋, ウェスト, 西方, ウエスタン, 西, 西, 西, 西, 西方, 西欧, 兌, 西側諸国, ウエスト",,de-DE,ja-JP
Leitung,"肝煎(り), 回路, 引率, かじ取り, 頭領, 誘導, 導(き), 統監, 主導, 首脳, 切(り)回し, 運営, 回線, 宰領, 指揮, 管掌, 指導, マネージ, 補導, 経理, 首脳部, 導管, リーダー･シップ, リード, 主管, ヘッドシップ, 主宰, 司会, コード, ダクト, 引(き), きょう導, 統裁, 伝導, 主管機関, 主事, 先導, 経営, 管理, ライン, トップ, ディレクション, 前導, 首脳陣",,de-DE,ja-JP
Version,"バージョン, バージョン, ヴァージョン",,de-DE,ja-JP
2002,二千二,,de-DE,ja-JP
Fokus,"ピント, 病巣, フォーカス, 的, 焦点, 焦点",,de-DE,ja-JP
cm,センチ･メートル,,de-DE,ja-JP
Behandlung,"待遇, 弁理, 操作, トリートメント, 扱(い), 処遇, 仕打(ち), 当(た)り, 処置, 取(り)扱(い), 取(り)扱(い), 持(て)成し, さばき, 処理, 取(り)計(ら)い, 取(り)回し, 応対, 療病, 遇, 処分, 扱い方, 矯正法, 仕向(け), お持て成し",,de-DE,ja-JP
erfolgen,"起(こ)る, 至る",,de-DE,ja-JP
Öffentlichkeit,"世上, 公, 公共性, 公儀, 本舞台, 人前, よそ目, 衆人, 明(か)るみ, く方, 世間一般の人々, 大方, 社会, おおびら, 公衆, こう間, 天下, 公, 公, ちまた, 江湖, 公共, 人中, 世間, 晴(れ), 公開, 大っぴら, く界, く界, 公共圏, パブリシティ, ちゅう人広衆, 公開性",,de-DE,ja-JP
mein,"ひ…, 私の, 俺の, 我(が), 当方の, 私の, 僕の, 手前の, マイ, 拙者の, ミー, 私的, 俺的",,de-DE,ja-JP
Zeitraum,"一時期, 間, …間, 間, 期, 期間",,de-DE,ja-JP
Prozess,"案件, 訴訟, 経過, 裁判, 処理過程, 作用, プロセス, 訴訟事件, 加工, 過程, 裁判沙汰, 訴え, 公事",,de-DE,ja-JP
übernehmen,"当(た)る, 襲用する, 受(け)持つ, 買う, 取(り)入れる, 分担する, 引(き)受ける, 継ぐ, 持つ, 負担する, 担当する, 受(け)継ぐ, 買(い)受ける, 乗っ取る, 引(き)取る, 引(き)取る, かぶる, 預(か)る, 預(か)る, 請(け)負う, 申(し)受ける, 荷(な)う, 譲(り)受ける",,de-DE,ja-JP
beschäftigt,"せわしない, 忙しい, 多事多端な, 険しい, せわしい, ビジー",,de-DE,ja-JP
Gefahr,"危なさ, 危難, 急, 剣のん, 冒険, 脅威, 危な気, 危地, 恐(れ), 危なっ気, ハザード, 危険さ, 危険有害性",,de-DE,ja-JP
recht,"〈一寸〉した, 当然, 右の, いい加減, いい加減, 可成, よい加減, よい加減, 至って, 大分, 結構, 結構, 中々, よろしい, よろしい, 順当, とても, 随分, 義に厚い, 相当に, 適正な, かなりの, 大分, 当然に, 相当, 相当, とっても, 順当な, ごっつ",,de-DE,ja-JP
Beruf,"使命, お仕事, 仕事, 職業, 専業, 商売, 専門, 生業, 〈生業〉, 稼業, 専門的職業, 職, 業体, 用務, 渡世, 勤め, 職務, 召命, お勤め, 本分, 業, メチエ, 業体, メチエー, メティエ",,de-DE,ja-JP
fahren,"運転する, 運航する, 運行する, 乗っかる, 航走する, 進行する, 航行する, 走る, 行く, 向(か)う, ドライビングする, 召す, 通行する, 行く, はせる, 運ぶ, 駆(け)付ける",,de-DE,ja-JP
Unfall,"災厄, 急変, 遭難, 珍事, 災難, 不幸, 出来事, まが事, アクシデント, 偶発事件, 奇禍, 偶然の出来事, 災禍, バンプ, 非常, 事故, 災害, 故, 変災, 難, 間違(い), 変事, 衝突事故, 変(わ)り, 急難, 異変, 若しもの事, 遭難事故",,de-DE,ja-JP
vertreten,"肩代わりする, 成(り)代(わ)る, …の代役を勤める, 主張する, 代理する, 代役を務める, 代弁する, 代任する, 代行する, 代表する, 差配をしている, …の代わりになる, 差配する",,de-DE,ja-JP
abgeschlossen,"孤立した, 閉鎖的な, 済(み), 終了した, 終わった, 閉鎖的",,de-DE,ja-JP
Größe,"サイズ, 立(っ)端, まか, 偉大, 巨人, 背, 判, 広遠さ, ビッグ･ネーム, たいく, 大気, 大立(て)者, 権威者, 広遠, 名家, 広さ, 規模, 寸法, 広大, 量, 大小, 丈, のり, 遠大, 権威, 背, 号数, 偉, 遠大さ, 身の丈, 価, 価, 身長, でかさ, 背丈, 背格好, 巨匠, 背格好, 大きさ, 偉大さ, 広目",,de-DE,ja-JP
Initiative,"発起, 発意, 主導権, 発意, 先手, イニシアティブ, 発議, 発議, 実力, イニシャティブ, イニシアチブ, 先べん, 主導性",,de-DE,ja-JP
Konzept,"下書(き), 草稿, コンセプト, 概念, 案文, 起稿, 案文, 観念, 案, コンセプション, 文案",,de-DE,ja-JP
Soldaten,"士卒, 兵ども",,de-DE,ja-JP
CDU,"キリスト教民主同盟, CDU",,de-DE,ja-JP
Wissenschaft,"ヴィッセンシャフト, サイエンス, 物学, 学問, 学究, 学術, 物学び, 科学, 学, ウィッセンシャフト",,de-DE,ja-JP
Liga,リーグ,,de-DE,ja-JP
