FrontText,BackText,Comment,FrontTextLanguage,BackTextLanguage
der,"ザ, その, それ",,de-DE,ja-JP
und,"且(つ), 又, 及び, だって, だの, そして, …だり, 並びに, んで, とか, エンド, さては, が, 且つ又, し, なお, なお, しかして, や, それで, さて, AND, …たり, それから, そうして, と, して, …やら, …やら, 加えて, でもって, でもって",,de-DE,ja-JP
die,"ザ, それ",,de-DE,ja-JP
in,"…には, …の間は, に, へ, ファディッシュ, 地内, ん, 後に, …において, で, で, …の間, の, …にて, …おける, イン, …の中に, …に於ける, インサイド, 地内, 中で, …おいて, ナウい, …にゃ",,de-DE,ja-JP
von,"就いて, に, よりも, ん, から, で, の, …にて, …の中に, デ, …に就いて, 因って",,de-DE,ja-JP
mit,"もって, もって, …をこめて, 共に, で, で, で, …にて, 因って, と, でもって, でもって",,de-DE,ja-JP
zu,"…には, 対する, に, へ, アット, 連れて, …において, から, で, …に対し, …にて, …おける, …につれて, …に於ける, …に対して, 対して, 対す, …おいて, あんまし, …にゃ",,de-DE,ja-JP
das,"の, それは, それ, それ, その事, そりゃ",,de-DE,ja-JP
im,に,,de-DE,ja-JP
für,"…には, 対する, …の間は, ん, …来, …の間, の, …に対し, …にとって, …としては, 代(わ)りに, …に対して, 対して, 対す, …にゃ",,de-DE,ja-JP
auf,"に, …の上の, へ, ん, …において, で, 開いた, の, …にて, 上, …おける, …に於ける, 基に, …おいて",,de-DE,ja-JP
sich,"互(い), 己, 己, 自分の, 自身",,de-DE,ja-JP
eine,"片や, {一人}",,de-DE,ja-JP
ein,"一台, 一つの, オン, とある, 一, 一つ, 一発, 一遍, 一遍, ある, {一人}, さる, 一の, {一人}の, ぽちっと",,de-DE,ja-JP
auch,"一に, 又, だって, やぱ, …にも, 〈矢張〉(り), も, も, 〈流石〉, 図像抄, やっぱ, …とも, 矢っ張り, やっぱし",,de-DE,ja-JP
als,"より, へ, …たら, 際, 時, と",,de-DE,ja-JP
nicht,"はい, 違う, あらず, ノット",,de-DE,ja-JP
an,"傍らに, に, に, へ, アット, そばに, 傍らの, 脇の, …において, くらい, で, 脇に, …にて, …おける, ぐらい, …に於ける, …おいて",,de-DE,ja-JP
werden,"回る, 回る, 相成る, 成る, 赴く, 生成する, おじゃる, 至る, される",,de-DE,ja-JP
Sie,"貴君, 尊台, 何れも方, 御自分, 御身, 貴台, 貴方, あんた, 〈貴方〉方, 子, 子, お前さん, 御辺, 尊兄, 大兄, 貴殿, あれさま, おもと, お身, けい, けい, 〈其方〉, 諸君, 尊堂, 〈其方〉, 貴下, きょう, きょう, 〈其方〉, 〈貴方〉, ご当家, なむだち, 雅兄, いずれもさま, 我が仏, 我が仏, 貴公, 賢兄, 足下, 足下, そっち, うぬら, お内, お内, そこもと, 高台, ユー, 御辺, 貴官",,de-DE,ja-JP
aus,"アウト, ん, オフ, から, で, の, アウツ",,de-DE,ja-JP
bei,"就いて, 傍らに, …に際して, …の側に, アット, 掛けて, そばに, 傍らの, …において, で, …に付け, …にて, …おける, 際, …に於ける, …に付けて, …おいて",,de-DE,ja-JP
er,"あの人, あの人, やっこ, やっこ, 彼氏, あいつ, その方, 向(こ)う, そ, 〈彼方〉, 〈彼奴〉, 某氏, 彼は, 〈此方〉, 先方, 彼, 彼, 彼(の)方, 御仁, 奴め, 奴め, しゃつめ",,de-DE,ja-JP
am,に,,de-DE,ja-JP
sie,"あの人, やっこ, やっこ, やつら, 彼女, 彼女, 彼ら, 彼女ら, あいつ, 彼女を, 彼女は, その方, 向(こ)う, そ, あの人たち, 〈彼方〉, 〈彼奴〉, あいつら, 彼らを, 奴輩, 某氏, 彼女が, 先方, 彼(の)方, 彼らは, 彼女達, 奴め, 奴め, しゃつめ",,de-DE,ja-JP
einer,"片や, 片っ方, {一人}, 片方, 片っぽ",,de-DE,ja-JP
nach,"に, 後, へ, アフター, 後に, から, 後, 後に, 末, 因って",,de-DE,ja-JP
oder,"一に, ないし, あるいは, あるいは, 若(し)くは, 若(し)くは, 又, それとも, 又は, 然らざれば, か, …ぬ, はい, あるは, or, or, はたまた, はた, や, と, …やら, …やら, って言うか, て言うか, てゆーか",,de-DE,ja-JP
einen,一統する,,de-DE,ja-JP
war,だった,,de-DE,ja-JP
um,"…には, 内外, …だけ, に, 近く, 近く, くらい, そこら, ぐらい, そこら辺り, …にゃ",,de-DE,ja-JP
über,"就いて, に, …の上の, 介して, 以上, …強, 頭上に, …に付け, 頭上, 以上の, 上, 上の, …に就いて, …に付けて, 上方に, 経て, スープラ",,de-DE,ja-JP
bis,"ないし, 掛けて, までに, まで",,de-DE,ja-JP
wie,"どう言う, 〈如何〉, さながら, 通り, 通り, どういうふうに, 〈如何〉, 様, 〈如何〉, 〈如何〉, あに, どういう訳で, みたい, みたい, どうやって, えんとして, 〈如何〉して, どの様に, どうとも, いかばかり, 〈如何〉に, して, どんなに, 〈如何〉にして, …の様に, どうやったら",,de-DE,ja-JP
vor,"対する, 以前に, 以前, …外, …に対し, 前に, 前, 前, 前, 前, …に対して, 対して, 対す, 正面に",,de-DE,ja-JP
durch,"以, もって, もって, に, 介して, …を介し, ウエル･ダン, から, で, …にて, …を介して, ウェル･ダン, 因って, 通じて, 通じて, 経て, でもって, でもって",,de-DE,ja-JP
noch,"ほかに, いまだに, やぱ, まだ, 今でも, 〈矢張〉(り), まだまだ, やっぱ, なお, なお, 更, 今もって, もっと, 今なお, 矢っ張り, いまだ, 更に, やっぱし, 今に, 加えて, 今も, 今もなお",,de-DE,ja-JP
haben,"擁する, 具備する, 抱く, 御座います, 帯びる, 抱える, 興す, 現有する, 含有する, 蔵する, 有る, 有る, 有る, 有る, する, 享受する, 持つ, 備える, やる, 備わる, あります, 帯する, 御座る, 裂く, …を具備する, 持っている, 具有する, 持ってる",,de-DE,ja-JP
nur,"単なる, ただ, なけなし, 物の, たった, …のみ, …だけ, 唯, 本の, 高が, 一介, ただに, 一方, たんだ, …しか…ない, 単に, 一つ, オンリー, ばっかし, しかだけ, だけに, …ばっかり, ただ, 一介の, 僅々, …限(り), ばかし, …足らず, ただただ, しか, …きり, 但(し), そこそこ, そこそこ, だけしか",,de-DE,ja-JP
können,"よろしい, よろしい, 差(し)支えない, 出来る, 得る, 得る, …げる",,de-DE,ja-JP
aber,"しかるに, もっとも, そうかと言って, しかしながら, さりながら, しかれども, それとて, けれども, だけども, だが, だって, けど, …たって, だけれど, それでも, にもかかわらず, にもかかわらず, それにしても, ところが, けれど, だけど, が, だけれども, そのかわり, でも, しかし, それなのに, かと言って, 但(し), ばってん, されど, されども, ですが, やけど, なれど, なれども, それだのに, けんど",,de-DE,ja-JP
so,"あの位, あれ位, あれ位, こうして, あんな風に, 通り, こんな具合に, このよう, しからしめる, そんなに, いんも, あれ程, ああして, ああいう風に, この様に, こんなに, かくのごとく, はい, このまま, あのように, そう, あんなに, かほど, ああ, あれしきの, その通り, こんな塩梅に, さて, 然, かく, こう, あれだけ, 左程, かくて, これほど, こういう風に, そうやって, こうやって, こげん",,de-DE,ja-JP
mehr,"もう, 一倍, この上の, 一層, 一層, 更なる, なお, なお, もっと, 一等, 一等, 余計な, より",,de-DE,ja-JP
wir,"こっち, 当方, 僕らは, おれら, こちら, ボクラ, 我ら, 余輩, 予, わたしたち, 我々, 弊社, 当家, 私共, 我(が)輩, 手前共, 我(が)方, 身共, おれ達, 自分達, 内等, こっちとら, こちとら",,de-DE,ja-JP
sein,"…ておる, …でござる, 御座います, います, 候, いらっしゃる, ありんす, まします, おる, おいでる, 存する, …でげす, だ, ごわす, ごわす, …ていらっしゃる, 有る, 有る, する, 御座ります, その, …でございます, いらせられる, やる, ごわんす, ごわんす, おいでになる, あります, です, 御座る, 居る, 御座します, おじゃる, もとのままである, 存在する, である, 彼の, おわす, っす, でやる, どす, おす, す, 御座んす, 御座んす",,de-DE,ja-JP
Es,イド,,de-DE,ja-JP
Jahr,"イヤー, 年度, 年齢, 年期, 季, 歳次, 年, 年, 年代",,de-DE,ja-JP
unter,"就いて, …中, 下級の, …の間で, 以下, …の間, …の中に, 内, 内, 間に, 基に",,de-DE,ja-JP
man,"人々, 世人, 人々, 人, 本官",,de-DE,ja-JP
wieder,"再び, 又, 薦…, やぱ, 又しても, 新たに, 改めて, 〈矢張〉(り), 事新しく, やっぱ, もう一度, 更, 又もや, 矢っ張り, 更に, やっぱし, も一度",,de-DE,ja-JP
sowie,"及び, 並びに, も, と",,de-DE,ja-JP
diese,"これら, この",,de-DE,ja-JP
dieser,"茲の, そ, その, この方, 御仁, 後者の, 後者",,de-DE,ja-JP
zwei,"二, ツー, 二つの, 二つ, 二, トゥー, 二, もろ, 一双, 両…, 二",,de-DE,ja-JP
ihre,〈貴方〉方の,,de-DE,ja-JP
gegen,"VS, 対する, 対, 近く, 近く, およそ, くらい, …に向かって, …と敵対して, …に対し, コントラ, ぐらい, 前後, …に対して, 対して, 対す, と",,de-DE,ja-JP
Menschen,"人々, ピープル, ピーポー",,de-DE,ja-JP
ich,"我(が)党, 我(が)党, こっち, 当方, 自分, 自分, だい公, 少弟, 少弟, だいふ, 外臣, 老, 老, ひ人, おのが, こちら, 我, 老生, 手めえ, 下名, 愚生, 私儀, 僕, 僕, {母さん}, 予, イッヒ, 拙者, 卑称, 晩生, あたし, あっし, 朕, 小生, この方, 隠居, お姉さん, 〈此方〉, あ子, あ子, 私共, それがし, うぬ, おら, 本官, 我, 本職, 本職, 己, 己, 小職, 小職, 内, 内, 不肖, 不肖, 私, おいら, わっち, I, 愚臣, 愚臣, 俺, 手前, 手前, 身共, 小官, おい, わて, あたい, ちょ材, ちょ才, ちょれき, こっちとら, こちとら, わだす, あたくし, 拙生, てんでん, 児, 児, わい, ミー, あちき, わちき, おいどん",,de-DE,ja-JP
Ein,入,,de-DE,ja-JP
dann,"それはそうとして, そうしたら, それでは, そして, それならば, 次いで, じゃ, さよなら, さよなら, さてさて, それなら, 左様なら, 左様なら, そしたら, …とすると, …とすると, となると, となると, では, じゃあ, しかして, それじゃ, そこで, すると, しからば, さても, そんなら, それから, そうして, してみると, しかるのち, ほな, してみれば",,de-DE,ja-JP
ab,"…から離れて, から, 離れて",,de-DE,ja-JP
alle,"御一統様, 皆人, 誰でも, 皆, 軒並(み), 有りと有る, だれでも皆, {一人}残らず, そっくり, 全員ことごとく, 各個, 門並(み), 各般の, いずれ, 諸氏, 全部, 誰も, 誰しも, どんな人でも, 全部の, 一同, ありとあらゆる, 百般の, 各, 全員, 端から, 誰も彼も, もろ, 皆々様, 各自, みんな, 誰{一人}, 有る限り, 皆さん, 諸般の, あらゆる, 各人, どれも, 一杯, 一杯, おしなべて, 皆様, 皆…, 皆々, 面々, すべての, 各位, どれどれ, どれどれ, 各般, 共, 一統, 一統, 皆の衆, 合切, 各…, …ながら, 一々, 一々, だれもが皆, だれもかも, てんでん, ぜい員",,de-DE,ja-JP
wenn,"〈何時〉, イフ, …たら, いやしくも, 癖に, ならば, から, いやしくも…以上は, …なら, が, すれば, 際, 時, もし…たら, と, 〈何時〉何時, 〈何時〉〈何時〉, すりゃ",,de-DE,ja-JP
Jahre,"風霜, 春秋, 日月, 歳月, 年数, 日月, うと, 年期, 春秋",,de-DE,ja-JP
immer,"ことごとに, 折々, 常々, 日夜, 始終, 終始, 終始, 常日頃, 寝ても覚めても, しょっちゅう, 毎度, 日頃, 絶えず, 常時, エバー, 〈何時〉でも, 旦夕, 年中, 〈何時〉も, 朝夕, どんな時にも, 年中, 年百年中, 年中, 朝晩, 常に, いつだって, 〈何時〉〈何時〉, 切れ目無く, どんな時も, 長時",,de-DE,ja-JP
zwischen,"ないし, 中間に, …の間で, 相中, …の間, 中間の, インター, 間に",,de-DE,ja-JP
Wir,朕,,de-DE,ja-JP
Zeit,"潮時, 時日, 時称, 時期, 機, 時節, 間, 暇, 日月, 世, 世, 歳月, 時刻, 候, 日き, 刻限, 日月, 間, 時世, 時勢, いとま, 所, 時代, 調, 節, 三まや, 期, 期間, 折(り), 代, 月日, 一世, 機運, テンス, 光陰, 時分, 時間, 期, 時限, タイム, 時, 時, 季節, 日々, 光, 時世, 日時, 日時, 時相, 星霜, 漏刻, みぎり, しん刻, 白く",,de-DE,ja-JP
sehr,"アッサイ, 多分に, つっと, 善く善く, よくせき, たいそうな, 至極, 至極, 大いに, 素敵, 本当に, たまらなく, 痛く, 至って, 余りに, さのみ, 大分, いと, 中々, 無性に, 恐ろしく, すこぶる, すこぶる付き, 滅法, どうも, 普通, 普通, たっぷり, 浩, 一番, 一方ならず, 其(れ)は其(れ)は, めっぽうに, 千万, 何とも, 余っ程, とても, 猛, 極めて, まんまんと, 随分, すごく, 千度, 千度, ほとんど, ほとんど, 頗る付きの, 大変に, 本に, 余程, 馬鹿に, 大きに, 大きに, 大分, 大層, 大変, 思い切り, 思い切り, うまうまと, いとど, この上なく, とっても, この上もなく, 極, 極, まんまと, 非常な, 非常に, なんまら, なまら, めっちゃ, むっちゃ, 偉い事, 偉い事, ごっつ, ベリー, めっさ, 極まりて",,de-DE,ja-JP
Für,賛成論,,de-DE,ja-JP
bereits,"もう, 早, 既に, 先刻, もはや, 兼ねて, 早くも",,de-DE,ja-JP
seit,"…である上は, …来, それきり, から, このかた, それっきり, …した上は",,de-DE,ja-JP
soll,…そうだ,,de-DE,ja-JP
drei,"三, 三(つ), 三, 三, 三つ, スリー",,de-DE,ja-JP
ihr,"彼らの, 何れも方, 彼女に, なんじ, おれら, 各, 〈貴方〉達, 者共, 者共, 彼女の, 皆様方, 君たちは, なむだち, いずれもさま, なんじら, うぬら, てめえら",,de-DE,ja-JP
schon,"もう, 早, 既に, 先刻, …だに, も, もはや, 兼ねて, 早くも",,de-DE,ja-JP
uns,"我々を, 我らに, 手前共を, 我々に, 僕らを, 我らを",,de-DE,ja-JP
was,"どう言う, の, 何ら, 〈如何〉, 何ら, 何, 〈如何〉, 〈何方〉, 〈如何〉, 〈如何〉, なあに, 何の, どうとも, 何事, どう言う事, どういうことか",,de-DE,ja-JP
jedoch,"もっとも, さりながら, しかれども, それとて, けれども, けど, それでも, にもかかわらず, にもかかわらず, 〈流石〉, それにしても, ところが, けれど, しかし, それなのに, かと言って, 但(し), …ども, ばってん, されど, されども, ですが, なれど, なれども, それだのに, けんど",,de-DE,ja-JP
Deutschland,"ドイツ, 独, 独国",,de-DE,ja-JP
damit,"ように, これで, ため, ために, ために, それによって, 以上をもって",,de-DE,ja-JP
Euro,"ユーロ, ユーロー",,de-DE,ja-JP
dabei,その際,,de-DE,ja-JP
etwa,"辺りに, 物の, 内外, 大体, 大体, およそ, くらい, ばっかし, ほぼ, …ばっかり, 概数で, ざっと, おおよそ, ばかし, ぐらい, …足らず, 約, 前後, 前後, およその, まず, 程",,de-DE,ja-JP
Ende,"明(け), 切(れ)目, 終末, 引け際, 際限, 末路, 出口, 末しょう, 末始終, 大詰(め), 結末, 末期, 端, 末方, テール･エンド, 尻, つい, びりっこけ, 極, 止めど, 段落, びり, 幕切(れ), 決着, 突(き)当(た)り, ワンラ, 詰(ま)り, 詰(ま)り, 後尾, 果(て)し, {尻尾}, びりっけつ, あっぱ, あっぱ, 先途, 末尾, 落(ち), 極(み), 端, 止(め), 末端, …末, 開(き), 跳(ね), 最終, うら, 終期, 果(て), 底止, 締め, 締め, 止(ま)り, 取(り)留め, びりっこ, 打(ち)留め, 終止, 終端, 団円, オメガ, 最後, エンド, エンド, 幕, 終尾, とことん, とことん, 方図, 結了, 末, 行(き)当(た)り, 一区切(り), 終えん, 切り, とう尾, 傍, ラスト, 結尾, ピリオド, おしまい, 端, 終局, 終結, 極所, ちょうび, 一杯, 一杯, 涯, 切(り)上げ, 結句, 結句, 終了, 句切(り), つま, ジ･エンド, 大切(り), 詰(め), 極(め), 先, 暮(れ), エンド･マーク, 終(わ)り, 末葉, 結局, 結局, 仕舞(い), 行(き)当(た)り, 大尾, びりけつ, 端っこ, 端っこ, どん詰(ま)り, どん詰(ま)り, 幕引き, 尾端, 界限, くくり, 了, 端っぽ",,de-DE,ja-JP
hier,"ここに, ここに, ここに, ここに, この辺, ここ, ここにおいて, ここで, はい, 〈此方〉, 当所において, この場",,de-DE,ja-JP
viele,"幾らも, どっさり, 八百八, 数多の, 沢山の, たんと, 幾…, 幾多, 八(つ), 幾つ, 大勢の, 数々, 数が多い, たんまり, 沢山, いくつもの, 幾つも, 幾つもの, 各…, 多山, 山沢, 数ある",,de-DE,ja-JP
Prozent,"パーセント, プロ, 割(り), 百分, プロセント, パー",,de-DE,ja-JP
nun,"はてな, 時に, まあ, まあ, ええと, どれ, 左様, 左様, それでは, ま, そして, はてさて, ここにおいて, じゃ, ところで, さてさて, …した現在では, はい, はい, 今更, 今更, ところが, えーと, 今頃はもう, さては, じゃあ, ただいまでは, 一体, それじゃ, いざや, さあ, さて, そこで, えー, さても, これから, はて, そうして, ええ, ええっと, ほな",,de-DE,ja-JP
selbst,"御自分, 自分, 自分, だって, 自分自身で, セルフ, 自分で, 自(ら), さえ, も, 一己, 〈流石〉, …すら, 自身で, さしもの, 己, 己, 本人自ら, 自身, 自体, 自体, 単身で, 自家, たりとも",,de-DE,ja-JP
da,"もって, そこ, ですから, ので, 〈何故〉ならば, 以上, んで, 〈何故〉なら, そこに, から, しかれば, 何となれば, ものゆえ, 〈彼方〉, だから, そこもと, ですので, もので, もんで, さかい",,de-DE,ja-JP
Stadt,"シティー, 都, シティ, 都会, 町内, ちまた, タウン, 町, 都市, 城府, 都, 市頭",,de-DE,ja-JP
müssen,"かなわない, ならぬ, 得無い, させられる, べきである, …ならない, 大便を催す, …べきだ",,de-DE,ja-JP
rund,"環状の, ぐりぐり, ぐりぐり, 円い, 円い, くるっと, 丸ぽちゃの, くるりと, 円らな, くりくり, まどかな, 丸味のある, ふっくり, まとまった, くるり, ぐりぐりっ, ふっくらとした, 概数で, 団々, でくでく, ぷくっ, 約, まどか, 団々たる, くるっ, ぷくっと, かれこれ, ぷっくり, つぶらか, ぽっこり",,de-DE,ja-JP
finden,"あなぐり出す, ゲットする, 探知する, 尋(ね)当てる, 拾う, 捜し当てる, 取る, 発見する, 捜し出す, 掘(り)出す, 拾得する, 得る, 得る, 見付ける, 検索する, 見付(け)出す",,de-DE,ja-JP
ohne,"…なくて, …なくて, 除いて, 空",,de-DE,ja-JP
Kinder,"子等, こぶ, 子女, キッズ, 子供たち, 児女, 子供ら, 子弟, 小人, 小, チルドレン",,de-DE,ja-JP
heute,"今では, 近頃, {今日}, 今日中に, 茲の, 今時, 今, 今, トゥデー, 本日, 今日, {今日}一日, {今日}の日, オッジ, ツデー",,de-DE,ja-JP
Unternehmen,"エンタプライズ, 企業, 会社, 事業, エンタープライズ, エンタープライゼス, ファーム, 企行",,de-DE,ja-JP
gut,"ファイン, ファイン, 達者に, 良, {上手}な, 無難な, 芳しい, ナイス, ナイス, 正しい, 無難の, 小気味のよい, 良好な, 令, グッド, グッド, 順調な, 上出来の, 順調に, 良し, うまい, 口当たりのよい, あんじょう, 〈美味〉しい, {大人}しい, グー, 好, ろくに, 佳良な, {上手}に, 人の良い, 良い, よろしい, よろしい, ろくすっぽう, よく, よく, 変わりなく, たっぷり, いい, ろくろく, 善良な, よし, 得意な, 優に, 親しい, 心の正しい, さて, ろくすっぽ, クリーン, 好調の, 善くぞ, ろくな, 出来のよい, 宜, まいうー, 白い, ボン",,de-DE,ja-JP
weiter,"もう, 且(つ), 又, この先, しかも, 先に, 且つ又, なお, なお, もっと, 一歩進んで, その他, 一段, 一段, 一等, 一等, 加えて, より",,de-DE,ja-JP
Ich,"自分, 自分, 自我, 主我, 自己",,de-DE,ja-JP
weitere,その外の,,de-DE,ja-JP
Uhr,"クロック, {時計}, 時しん儀",,de-DE,ja-JP
viel,"多分に, どっさり, たいそうな, 大いに, うんとこさ, うんとこさ, 〈数多〉, 数多の, いそ, たんと, 色んな, か多の, うんと, 余計に, 多い, 多分, 多分の, もっとずっと, やたらに, 多大の, 数多く, 仰山, 数多, 多大, 豊(か), 浩, 仰山な, 多量の, ムーチョ, か多, やたら, 幾多の, いろいろな, 余計, 余計, 多々, はるかに, 数多い, 多くの, 一杯, 一杯, か多な, 大層, はるか, たんまり, ずっと, 沢山, ずうっと, 大量の, 余計な, 多数の, なんまら, やたらめったら, 多山, 多き, がっつり, 山沢, どんと",,de-DE,ja-JP
ihm,彼に,,de-DE,ja-JP
ihn,彼を,,de-DE,ja-JP
erste,初…,,de-DE,ja-JP
andere,"その外の, その外, 余人, 余の, 余人, ほかの人",,de-DE,ja-JP
machen,"合格する, 下す, なさる, 仕出かす, やらせる, やらかす, こしらえる, せる, 致します, こさえる, 致す, 作る, 作る, 作る, 作る, 製する, 使う, する, させる, 入れる, 成る, なせる, やる, 印する, 決める, なす, 取る, 演じる, しめる, つかまつる, 申(し)上げる, なされる, せしむる, 行ずる, される, さらす",,de-DE,ja-JP
dort,"そこ, あちらに, かの地, 〈彼処〉, 〈彼処〉, そこに, 貴地, 〈彼処〉, 〈彼方〉, 〈其方〉, あちらで, 〈其方〉, 〈此方〉, 彼の辺, あの辺り, そこで, 〈彼方〉, そこが, そっち, 〈彼方〉, そこもと",,de-DE,ja-JP
Teil,"お福分け, おすそわけ, ピース, 部位, セグメント, 裾分け, 局部, 分, 片, 片, 部, 部, 所, 分子, 節, 箇所, 部品, 編, 編, 部材, 取り代, 部分, 局所, 奴",,de-DE,ja-JP
vier,"フォア, 四(つ), 四, フォアー, 四, 四, 四, フォーア, フォー, 四つ, テトラ",,de-DE,ja-JP
dazu,"さえ, …すら, その上, 加うるに, し, 更, 更に, このために, 加えて, 付(け)加えると, そのために, それに加えて, このため",,de-DE,ja-JP
ganz,"皆目, 挙げて, 段段乎たる, 至極, 至極, 正しい, 丸々, 丸々, もはら, 土台, 土台, もろに, …ずくめ, ぼっかり, 全般の, 丸っ切り, かいくれ, およそ, 十分, ばらりと, だんだんこ, 奇麗な, 一, すっかり, すっかり, 全…, 真…, ほとほと, 余す所なく, 丸ごと, 一切の, 丸切り, こてんぱ, 〈一向〉, 十分な, 余っ程, 根切り葉切り, 全体的, またく, がらり, 随分, 全幅の, 全て, すっぽり, おおよそ, ぴたり, 丸…, なみなみ, 余程, こてんぱん, 一杯, 一杯, 残らず, 全く, ほっかり, ばっちり, 何となく, 一切, ぴったり, 全体の, 赤, 赤, 根っ切り葉っ切り, こてんこてん, まったくの, 真…, 〈只管〉, ばらり, 全くもって, …尽(く)め, 有無に, ホール, がらっと, 全き, どうもこうも, ぴったし",,de-DE,ja-JP
erhalten,"保持する, 有り付く, 拝する, 保つ, 領収する, 入る, 保存する, 浴する, 食う, 食う, 被る, 維持する, 落手する, 収納する, 受信する, 領する, 拾う, 承る, 手に入れる, 賜(わ)る, 受領する, もらい下げる, 奉じる, 下される, 拝受する, 食(ら)う, 取る, 引(き)取る, 引(き)取る, もらう, 受ける, 収受する, 受(け)取る, 申(し)受ける, 頂く, 奉ずる, 入手する, つなぐ, 保有する, ちょうだいする, もらい受ける",,de-DE,ja-JP
während,"しかるに, …中, 傍らに, 傍らの, …たら, 共に, …において, 中, …の間, …おける, 内, 内, …に於ける, 同時の, 間に, …おいて, 中, 間中",,de-DE,ja-JP
jetzt,"現今は, 今では, この場で, 今般, 今のうち, ただ今, ただ今, このごろ, この度, 今は, 目今, これ, こたび, 今時, 今, 今, 今度, 今更, 今更, 今度こそは, 今頃はもう, この時, この程, ここんところ, 今時分, 方今, 現時点で, 現時点, 現時点は, ナウ, このところ, 今程, 今来",,de-DE,ja-JP
möglich,"可能な, 有りそう, 可能性のある, 本当らしい",,de-DE,ja-JP
nicht mehr,もはや,,de-DE,ja-JP
statt,代(わ)りに,,de-DE,ja-JP
sollte,はず,,de-DE,ja-JP
lassen,"やらせる, 置く, 置く, せる, させる, しめる, 差(し)置く, せしむる",,de-DE,ja-JP
